question;option_a;option_b;option_c;option_d;correct_option;probability
"The ""_____"" characteristic of a primary key states that the primary key should not have embedded semantic meaning.";unique values; nonintelligent; preferably single-attribute; security-compliant;nonintelligent;1
From a structural point of view, 3NF is better than _____.;2NF;3NF;5NF;6NF;2NF;1
Normalization works through a series of stages called normal forms. For most purposes in business database design, _____ stages are as high as you need to go in the normalization process.;two;three;four;five;three;1
From a structural point of view, 2NF is better than _____.;1NF;3NF;4NF;BCNF;1NF;1
An attribute that is part of a key is known as a(n) _____ attribute.;important;nonprime;prime;entity;prime;1
Attribute A _____ attribute B if all of the rows in the table that agree in value for attribute A also agree in value for attribute B.;determines; derives from; controls; owns;determines;1
Some very specialized applications may require normalization beyond the _____.;1NF;2NF;3NF;4NF;4NF;1
Of the following normal forms, _____ is mostly of theoretical interest.;1NF;3NF;BCNF;DKNF;DKNF;1
A table that has all key attributes defined, has no repeating groups, and all its attributes are dependent on the primary key is said to be in _____.;1NF;2NF;3NF;4NF;1NF;1
A(n) _____ exists when there are functional dependencies such that Y is functionally dependent on X, Z is functionally dependent on Y, and X is the primary key.;partial dependency;repeating group;atomic attribute;transitive dependency;transitive dependency;1
A _____ derives its name from the fact that a collection of multiple entries of the same type can exist for any single key attribute occurrence.;partial dependency;transitive dependency;repeating group;primary key;repeating group;1
A relational table must not contain a(n) _____.;entity; attribute;relationship;repeating group;repeating group;1
In a(n) _____ diagram, the arrows above the attributes indicate all desirable dependencies.;Chen; dependency; functionality; ER;dependency;1
Dependencies based on only a part of a composite primary key are known as _____ dependencies.;primary;partial;incomplete;composite;partial;1
If a table has multiple candidate keys and one of those candidate keys is a composite key, the table can have _____ based on this composite candidate key even when the primary key chosen is a single attribute.;Boyce-Codd normal forms;redundancies;time-variances;partial dependencies;partial dependencies;1
A table that is in 2NF and contains no transitive dependencies is said to be in _____.;1NF; 2NF; 3NF; 4NF;3NF;1
Improving _____ leads to more flexible queries.;derived attribute;atomicity;normalization;denormalization;atomicity;1
An atomic attribute _____.;cannot be further subdivided;displays multiplicity;cannot exist in a relational table;is always chosen to be a foreign key;cannot be further subdivided;1
The most likely data type for a surrogate key is _____.;numeric;logical;date;character;numeric;1
Granularity refers to _____.;the level of detail represented by the values in a table`s row;the size of a table;the number of attributes represented in a table;the number of rows in a table;the level of detail represented by the values in a table`s row;1
From a system functionality point of view, _____ attribute values can be calculated when they are needed to write reports or invoices.;atomic;granular; historical;derived;derived;1
In a real-world environment, we must strike a balance between design integrity and _____.;ease of use;robustness;uniqueness;flexibility;flexibility;1
To generate a surrogate key, Microsoft Access uses a(n) _____ data type.;AutoNumber;character;identity;sequence;AutoNumber;1
BCNF can be violated only if the table contains more than one _____ key.;foreign;secondary; primary;candidate;candidate;1
When a table contains only one candidate key, _____ are considered to be equivalent.;the BCNF and the DKNF;the 1NF and the 2NF;the 3NF and the BCNF;the 4NF and the 3NF;the 3NF and the BCNF;1
In a _____ situation, one key determines multiple values of two other attributes and those attributes are independent of each other.; transitive dependency;partial dependency;functional dependency;multivalued dependency;multivalued dependency;1
A table where all attributes are dependent on the primary key but are independent of each other, and no row contains two or more multivalued facts about an entity is said to be in _____.;4NF; 1NF; 2NF; 3NF;4NF;1
A table is in 4NF if it is in 3NF, and _____.;all attributes are unrelated;no column contains the same values; all attributes must be dependent on the primary key and must be dependent on each other;it has no multivalued dependencies;it has no multivalued dependencies;1
An example of denormalization is using a _____ denormalized table to hold report data. This is required when creating a tabular report in which the columns represent data that are stored in the table as rows.;transitive;3NF;component;temporary;temporary;1
Data warehouse routinely uses _____ structures in its complex, multilevel, multisource data environment.;2NF;1NF; 3NF; 4NF;2NF;1
_____ databases reflect the ever-growing demand for greater scope and depth in the data on which decision support systems increasingly rely.;Normalized; Temporary; Report; Data Warehouse;Data warehouse;1
The SQL data manipulation command HAVING:;restricts the selection of rows based on a conditional; restricts the selection of grouped rows based on a expression condition.; modifies an attributes values in one or more tables; groups the selected rows based on one or more rows.;restricts the selection of grouped rows based on a expression condition.;1
The SQL command that allows a user to permanently save data changes is _____.;INSERT; SELECT; COMMIT; UPDATE;COMMIT;1
The _____ command defines a default value for a column when no value is given.;CHECK; UNIQUE; NOT NULL; DEFAULT;DEFAULT;1
The _____ command restricts the selection of grouped rows based on a condition.;DISPLAY; HAVING; FROM; CONVERT;HAVING;1
A(n) _____ query specifies which data should be retrieved and how it should be filtered, aggregated, and displayed.;INSERT; SELECT; COMMIT; UPDATE;SELECT;1
A(n) _____ is an alternate name given to a column or table in any SQL statement.;alias; data type; stored function; trigger;alias;1
According to the rules of precedence, which of the following computations should be completed first?;Additions and subtractions; Multiplications and divisions; Operations within parentheses; Power operations;Operations within parentheses;1
Which query is used to list a unique value for V_CODE, where the list will produce only a list of those values that are different from one another?;"SELECT ONLY V_CODE FROM PRODUCT;";" SELECT UNIQUE V_CODE FROM PRODUCT;";" SELECT DIFFERENT V_CODE FROM PRODUCT;";" SELECT DISTINCT V_CODE FROM PRODUCT;";"SELECT ONLY V_CODE FROM PRODUCT;";1
When using a(n) _____ join, only rows from the tables that match on a common value are returned.;full; outer; inner; set;inner;1
A(n) _____ join will select only the rows with matching values in the common attribute(s).;natural; outer; full; cross;natural;1
If a designer wishes to create an inner join, but the two tables do not have a commonly named attribute, he can use a(n) _____ clause.;OF; USING; HAS; JOIN ON;JOIN ON;1
A(n) _____ join returns not only the rows matching the join condition (that is, rows with matching values in the common columns) but also the rows with unmatched values.;outer; inner; equid; cross;outer;1
The syntax for a left outer join is _____.;SELECT column-list FROM table1 OUTER JOIN table2 LEFT WHERE join-condition; SELECT column-list FROM table1 LEFT [OUTER] JOIN table2 ON join-condition; SELECT column-list WHERE LEFT table1 = table; SELECT column-list FROM table1 LEFT table2 [JOIN] WHERE join-condition;SELECT column-list FROM table1 LEFT [OUTER] JOIN table2 ON join-condition;1
A(n) _____ join performs a relational product (also known as the Cartesian product) of two tables.;full; cross; natural; equi;cross;1
How many rows would be returned from a cross join of tables A and B, if A contains 8 rows and B contains 18?;8; 18; 26; 144;144;1
Which comparison operator indicates a value is not equal?;<; <=; >=; <>;<>;1
What type of command does this SQL statement use? SELECT P_CODE, P_DESCRIPT, P_PRICE_V_NAME FROM PRODUCT, VENDOR WHERE PRODUCT.V_CODE=VENDOR. V_CODE;set operator; natural join;old-style join; procedural statement;old-style join;1
The special operator used to check whether an attribute value is within a range of values is _____.;BETWEEN; NULL; LIKE; IN;BETWEEN;1
The special operator used to check whether an attribute value matches a given string pattern is _____.;BETWEEN; IS NULL; LIKE; IN;LIKE;1
The SQL aggregate function that gives the number of rows containing non-null values for a given column is _____.;COUNT; MIN; MAX; SUM;COUNT;1
A(n) _____ is a query that is embedded (or nested) inside another query.;alias; operator; subquery; view;subquery;1
In subquery terminology, the first query in the SQL statement is known as the _____ query.;outer; left; inner; base;outer;1
The special operator used to check whether a subquery returns any rows is _____.;BETWEEN; EXISTS; LIKE; IN;EXISTS;1
Which is a feature of a correlated subquery?;The inner subquery executes first.; The outer subquery initiates the process of execution in a subquery.; The outer subquery executes independent of the inner subquery.; The inner subquery initiates the process of execution in a subquery.;The outer subquery initiates the process of execution in a subquery.;1
The _____ function returns the current system date in MS Access.;TO_DATE(); SYSDATE(); DATE(); TODAY();DATE();1
When using the Oracle TO_DATE function, the code _____ represents a three-letter month name.;MON; MM3; MONTH; MM;MON;1
_____ is a string function that returns the number of characters in a string value.;LENGTH; SUBSTRING; CONCAT; UCASE;LENGTH;1
The Oracle _____ function compares an attribute or expression with a series of values and returns an associated value or a default value if no match is found.;NVL; TO_CHAR; DECODE; CONVERT;DECODE;1
In Oracle, the _____ function converts a date to a character string.;CONVERT(); TO_DATE; TO_CHAR(); TO_STRING();TO_CHAR();1
_____ is a relational set operator.;EXCEPT; PLUS; ALL; EXISTS;EXCEPT;1
When you create a new database, the RDBMS automatically creates the data _____ tables in which to store the metadata and creates a default database administrator.;index; chapter; dictionary; appendix;dictionary;1
Which SQL format would be best used for a small, numeric data type?;INTEGER; SMALLINT; NUMERIC(L, D); CHAR(L);SMALLINT;1
When writing SQL table-creating command sequences, the entire table definition is enclosed in _____.;asterisks; commas; quotations; parentheses;parentheses;1
"The _____ specification creates an individual index on a respective attribute; use it to avoid having duplicated values in a column.";UNIQUE; NOT NULL; UPDATE; VARCHAR;UNIQUE;1
Words used by a system that cannot be used for any other purpose are called _____ words. For example, in Oracle SQL, the word INITIAL cannot be used to name tables or columns.;reserved; unique; null; character;reserved;1
"You cannot have an invalid entry in the foreign key column; at the same time, you cannot delete a vendor row as long as a product row references that vendor. This is known as _____.";batch updating; referential integrity; authentication; cross joining;referential integrity;1
The _____ constraint assigns a value to an attribute when a new row is added to a table.;NOT NULL; CASCADE; UNIQUE; DEFAULT;DEFAULT;1
The _____ constraint is used to validate data when an attribute value is entered.;UNIQUE; CASCADE; CHECK; SET NULL;CHECK;1
The CREATE TABLE command lets you define constraints when you use the CONSTRAINT keyword, known as a(n) _____ constraint.;column; table; index; cell;table;1
Using the _____ command, SQL indexes can be created on the basis of any selected attribute.;CREATE INDEX; UPDATE CASCADE;SELECT; VARCHAR;CREATE INDEX;1
All changes in a table structure are made using the _____ TABLE command, followed by a keyword that produces the specific changes a user wants to make.;ALTER; COMMIT; UPDATE; ROLLBACK;ALTER;1
A table can be deleted from the database by using the _____ TABLE command.;DROP; DELETE; MODIFY; ERASE;DROP;1
SQL requires the use of the _____ command to enter data into a table.;INSERT; SELECT; COMMIT; NOT NULL;INSERT;1
The _____ command permanently saves all changes such as rows added, attributes modified, and rows deleted made to any table in the database.;COMMIT; SELECT; ROLLBACK; UPDATE;COMMIT;1
Which command would be used to delete the table row where the P_CODE is `BRT-345`?;"DELETE FROM PRODUCT WHERE P_CODE = `BRT-345`;";" REMOVE FROM PRODUCT WHERE P_CODE = `BRT-345`;";" ERASE FROM PRODUCT WHERE P_CODE = `BRT-345`;";" ROLLBACK FROM PRODUCT WHERE P_CODE = `BRT-345`;";"DELETE FROM PRODUCT WHERE P_CODE = `BRT-345`;";1
When a user issues the DELETE FROM tablename command without specifying a WHERE condition, _____.;no rows will be deleted; the first row will be deleted; the last row will be deleted; all rows will be deleted;all rows will be deleted;1
The _____ command is used to restore the database to its previous condition.;ROWCOUNT; BACKUP; COMMIT; ROLLBACK;ROLLBACK;1
The tables on which a view, or a virtual table derived from a SELECT query, are based are called _____ tables.;indexed; core; relation; base;base;1
The Oracle equivalent to an MS Access AutoNumber is a(n) _____.;auto-number; sequence; TO_NUMBER function; trigger;sequence;1
Which statement describes a feature of Oracle sequences?;Oracle sequences are tied to columns and tables.; Oracle sequences generate a character string that can be assigned to tables.; An Oracle sequence uses the identity column property to automatically number rows.;" Dropping a sequence does not delete values assigned to table attributes; it deletes only the sequence";"Dropping a sequence does not delete values assigned to table attributes; it deletes only the sequence";1
The _____ pseudo-column is used to select the next value from a sequence.;CURRVAL; NEXTVAL; NEXT; GET_NEXT;NEXTVAL;1
In Oracle, _____ retrieves the current value of a sequence.;NEXTVAL; CURRVAL; VARCHAR; VARCHAR2;CURRVAL;1
In Oracle, _____ make(s) it possible to merge SQL and traditional programming constructs, such as variables, conditional processing (IF-THEN-ELSE), basic loops (FOR and WHILE loops,) and error trapping.;dynamic SQL; stored procedures; embedded SQL; Procedural Language SQL;Procedural Language SQL;1
A _____ is a block of code containing standard SQL statements and procedural extensions that is stored and executed at the DBMS server.;cursor-style process; statement-level trigger; base table; persistent storage module (PSM);persistent storage module (PSM);1
The PL/SQL block starts with the _____ section.;IS; OPEN; DECLARE; BEGIN;DECLARE;1
The Oracle string concatenation function is _____.;CONCAT; +; ||; &&;||;1
Oracle recommends _____ for creating audit logs.;triggers; stored procedures; stored functions; tables;triggers;1
A(n) _____ cursor is automatically created in procedural SQL when the SQL statement returns only one value.;implicit; dynamic; explicit; static;implicit;1
_____ is a cursor attribute that returns TRUE if the last FETCH returned a row, and FALSE if not.;%ROWCOUNT; %NOTFOUND; %FOUND; %ISOPEN;%FOUND;1
No matter what language you use, if it contains embedded SQL statements, it is called the _____ language.;base; static; host; view;host;1
